uid,title,abstract,year,venue,authors,doi,arxiv_id,url,source,query,query_role,family,advisor_seed,citation_count,matched_terms,retrieved_at,relevance_score,hostile_score
doi:10.1093/med/9780199680467.003.0016,Evaluation of interventions in the real world,"The goal of global mental health trials is to generate knowledge that can be implemented in the much messier ‘real world’. However, the effect of interventions in the real world may be different from, and most likely much smaller than, the effect sizes reported in trials. It is therefore essential that we evaluate their implementation and effect when they are ‘scaled-up’ as real programmes. The evaluation of scaled-up health programmes typically involves the use of multiple methods which are triangulated to address the key questions of the programme leaders or investigators. This chapter aims to describe what outcomes we might be interested in evaluating and the methods we might use to assess these outcomes, and presents selected case studies which demonstrate these methods in action.",2015,Oxford Medicine Online,Mary J. De Silva; Alex Cohen; Vikram Patel,10.1093/med/9780199680467.003.0016,,https://doi.org/10.1093/med/9780199680467.003.0016,crossref,real world robot learning deployment,concept,deployment,,2,deployment,2026-06-12T15:07:36Z,17.549,20.549
doi:10.1002/ehf2.15320,Real-World Use of Guideline-Directed Therapy for Heart Failure: Insights From the Danish Heart Failure Registry,"Abstract Aims We aimed to assess real-world implementation of guideline-directed medical therapy (GDMT) for heart failure (HF) with reduced ejection fraction (HFrEF) and its association with mortality and hospitalization. Methods We analysed 46 816 incident HFrEF patients from the Danish Heart Failure Registry (2008–2022). We examined the utilization of GDMT—renin–angiotensin system inhibitors (RASi), beta-blockers, mineralocorticoid receptor antagonists (MRAs) and sodium-glucose cotransporter-2 inhibitors (SGLT2i)—at 4, 8 and 12 weeks of follow-up according to the European Society of Cardiology guidelines within the intervals 2008–2011, 2012–2015, 2016–2020 and 2021–2022. Using Cox regression, we assessed the associations between GDMTs [none (reference), 1–2 GDMTs, and 3–4 GDMTs] initiated at 4, 8 and 12 weeks and 1 and 3 year mortality (all-cause and cardiovascular) and hospitalization",2025,ESC Heart Failure,Inge Schjødt; Jan B. Valentin; Søren P. Johnsen; Rikke E. Mols; Kenneth Egstrup; Brian B. Løgstrup,10.1002/ehf2.15320,,https://doi.org/10.1002/ehf2.15320,crossref,robot world model failure,anti_myopia,anti_thesis,,6,robot world model; robot world model failure,2026-06-12T15:07:36Z,15.523,20.523
arxiv:2604.21741v2,Hi-WM: Human-in-the-World-Model for Scalable Robot Post-Training,"Post-training is essential for turning pretrained generalist robot policies into reliable task-specific controllers, but existing human-in-the-loop pipelines remain tied to physical execution: each correction requires robot time, scene setup, resets, and operator supervision in the real world. Meanwhile, action-conditioned world models have been studied mainly for imagination, synthetic data generation, and policy evaluation. We propose \textbf{Human-in-the-World-Model (Hi-WM)}, a post-training framework that uses a learned world model as a reusable corrective substrate for failure-targeted policy improvement. A policy is first rolled out in closed loop inside the world model; when the rollout becomes incorrect or failure-prone, a human intervenes directly in the model to provide short corrective actions. Hi-WM caches intermediate states and supports rollback and branching, allowing a si",2026,arXiv,Yaxuan Li; Zhongyi Zhou; Yefei Chen; Yanjiang Guo; Jiaming Liu; Shanghang Zhang; Jianyu Chen; Yichen Zhu,,2604.21741v2,http://arxiv.org/abs/2604.21741v2,arxiv,robot world model failure,anti_myopia,anti_thesis,,,robot world model; robot world model failure,2026-06-12T15:07:36Z,14.450,20.450
doi:10.2139/ssrn.6626705,"Open Access, Unequal Use: Evaluation Infrastructure as the Missing Bottleneck in Foundation Model Democratisation","Open access to foundation models has fuelled claims that artificial intelligence will democratise innovation by lowering entry barriers to experimentation and use. This paper argues that such claims overreach. Access to models does not translate automatically into broad innovative participation because organisations also need credible means to evaluate model performance in situated tasks. We introduce evaluation infrastructure as the shared or shareable socio-technical arrangements that make model quality and task fit assessable for use. These arrangements include benchmarking systems, validation protocols, testing resources, auditing procedures, and domain-specific interpretive standards. Our core argument is that evaluation infrastructure conditions whether actors can convert technical availability into disciplined experimentation and legitimate deployment. When this infrastructure is ",,,Dinesh Kumar; Nidhi Suthar,10.2139/ssrn.6626705,,https://doi.org/10.2139/ssrn.6626705,crossref,robot foundation model failure mode,hostile,failure,,,robot foundation model; failure mode; benchmark; deployment,2026-06-12T15:07:36Z,13.300,20.300
arxiv:2403.12675v2,Pragmatic Competence Evaluation of Large Language Models for the Korean Language,"Benchmarks play a significant role in the current evaluation of Large Language Models (LLMs), yet they often overlook the models' abilities to capture the nuances of human language, primarily focusing on evaluating embedded knowledge and technical skills. To address this gap, our study evaluates how well LLMs understand context-dependent expressions from a pragmatic standpoint, specifically in Korean. We use both Multiple-Choice Questions (MCQs) for automatic evaluation and Open-Ended Questions (OEQs) assessed by human experts. Our results show that GPT-4 leads with scores of 81.11 in MCQs and 85.69 in OEQs, closely followed by HyperCLOVA X. Additionally, while few-shot learning generally improves performance, Chain-of-Thought (CoT) prompting tends to encourage literal interpretations, which may limit effective pragmatic inference. Our findings highlight the need for LLMs to better under",2024,arXiv,Dojun Park; Jiwoo Lee; Hyeyun Jeong; Seohyun Park; Sungeun Lee,,2403.12675v2,http://arxiv.org/abs/2403.12675v2,arxiv,large language model limitation robot planning,anti_myopia,anti_thesis,,,limitation; benchmark; large language model limitation robot planning,2026-06-12T15:07:36Z,14.250,20.250
arxiv:2512.10675v2,Evaluating Gemini Robotics Policies in a Veo World Simulator,"Generative world models hold significant potential for simulating interactions with visuomotor policies in varied environments. Frontier video models can enable generation of realistic observations and environment interactions in a scalable and general manner. However, the use of video models in robotics has been limited primarily to in-distribution evaluations, i.e., scenarios that are similar to ones used to train the policy or fine-tune the base video model. In this report, we demonstrate that video models can be used for the entire spectrum of policy evaluation use cases in robotics: from assessing nominal performance to out-of-distribution (OOD) generalization, and probing physical and semantic safety. We introduce a generative evaluation system built upon a frontier video foundation model (Veo). The system is optimized to support robot action conditioning and multi-view consistency",2025,arXiv,Gemini Robotics Team; Krzysztof Choromanski; Coline Devin; Yilun Du; Debidatta Dwibedi; Ruiqi Gao; Abhishek Jindal; Thomas Kipf; Sean Kirmani; Isabel Leal; Fangchen Liu; Anirudha Majumdar; Andrew Marmon; Carolina Parada; Yulia Rubanova; Dhruv Shah; Vikas Sindhwani; Jie Tan; Fei Xia; Ted Xiao,,2512.10675v2,http://arxiv.org/abs/2512.10675v2,arxiv,energy based policy robotics,concept,ebm,,,safety constraint; generalization; out of distribution; real world evaluation,2026-06-12T14:45:03Z,16.200,20.200
doi:10.1007/978-3-031-38651-0_17,Research on the Evaluation of the Teaching Process of Public Physical Education in Universities Based on Markov Model,,2023,Learning and Analytics in Intelligent Systems Advances in Computational Vision and Robotics,Yilin Li,10.1007/978-3-031-38651-0_17,,https://doi.org/10.1007/978-3-031-38651-0_17,crossref,vision language action model limitation robotics,hostile,failure,,,vision language action model; limitation,2026-06-12T14:45:03Z,14.200,20.200
arxiv:2506.05429v1,Coordinated Robustness Evaluation Framework for Vision-Language Models,"Vision-language models, which integrate computer vision and natural language processing capabilities, have demonstrated significant advancements in tasks such as image captioning and visual question and answering. However, similar to traditional models, they are susceptible to small perturbations, posing a challenge to their robustness, particularly in deployment scenarios. Evaluating the robustness of these models requires perturbations in both the vision and language modalities to learn their inter-modal dependencies. In this work, we train a generic surrogate model that can take both image and text as input and generate joint representation which is further used to generate adversarial perturbations for both the text and image modalities. This coordinated attack strategy is evaluated on the visual question and answering and visual reasoning datasets using various state-of-the-art visi",2025,arXiv,Ashwin Ramesh Babu; Sajad Mousavi; Vineet Gundecha; Sahand Ghorbanpour; Avisek Naug; Antonio Guillen; Ricardo Luna Gutierrez; Soumyendu Sarkar,,2506.05429v1,http://arxiv.org/abs/2506.05429v1,arxiv,vision language action model limitation robotics,hostile,failure,,,vision language action model; limitation; robustness; deployment,2026-06-12T14:45:03Z,12.150,20.150
arxiv:2603.12510v3,Red-Teaming Vision-Language-Action Models via Quality Diversity Prompt Generation for Robust Robot Policies,"Vision-Language-Action (VLA) models have significant potential to enable general-purpose robotic systems for a range of vision-language tasks. However, the performance of VLA-based robots is highly sensitive to the precise wording of language instructions, and it remains difficult to predict when such robots will fail. We propose Quality Diversity (QD) optimization as a natural framework for red-teaming embodied models, and present Q-DIG (Quality Diversity for Diverse Instruction Generation), which performs red-teaming by scalably identifying diverse, natural language task descriptions that induce failures while remaining task-relevant. Q-DIG integrates QD techniques with Vision-Language Models (VLMs) to generate a broad spectrum of adversarial instructions that expose meaningful vulnerabilities in VLA behavior. Our results across multiple simulation benchmarks show that Q-DIG finds more",2026,arXiv,Siddharth Srikanth; Freddie Liang; Ya-Chuan Hsu; Varun Bhatt; Shihan Zhao; Henry Chen; Bryon Tjanaka; Minjune Hwang; Akanksha Saran; Daniel Seita; Aaquib Tabrez; Stefanos Nikolaidis,,2603.12510v3,http://arxiv.org/abs/2603.12510v3,arxiv,vision language action model limitation robotics,hostile,failure,,,vision language action model; failure mode; limitation; benchmark; robustness; real world evaluation,2026-06-12T14:45:03Z,11.150,20.150
doi:10.3390/s24092794,"Bridging Requirements, Planning, and Evaluation: A Review of Social Robot Navigation","Navigation lies at the core of social robotics, enabling robots to navigate and interact seamlessly in human environments. The primary focus of human-aware robot navigation is minimizing discomfort among surrounding humans. Our review explores user studies, examining factors that cause human discomfort, to perform the grounding of social robot navigation requirements and to form a taxonomy of elementary necessities that should be implemented by comprehensive algorithms. This survey also discusses human-aware navigation from an algorithmic perspective, reviewing the perception and motion planning methods integral to social navigation. Additionally, the review investigates different types of studies and tools facilitating the evaluation of social robot navigation approaches, namely datasets, simulators, and benchmarks. Our survey also identifies the main challenges of human-aware navigatio",2024,Sensors,Jarosław Karwowski; Wojciech Szynkiewicz; Ewa Niewiadomska-Szynkiewicz,10.3390/s24092794,,https://doi.org/10.3390/s24092794,crossref,robot world model failure planning,hostile,failure,,12,robot world model; motion planning; benchmark; robot world model failure,2026-06-12T15:07:36Z,13.032,20.032
doi:10.4108/airo.8870,Evaluating Open-Source Vision Language Models for Facial Emotion Recognition Against Traditional Deep Learning Models,"Facial Emotion Recognition (FER) is crucial for applications such as human-computer interaction and mental health diagnostics. This study presents the first empirical comparison of open-source Vision-Language Models (VLMs), including Phi-3.5 Vision and CLIP, against traditional deep learning models—VGG19, ResNet-50, and EfficientNet-B0—on the challenging FER-2013 dataset, which contains 35,887 low-resolution, grayscale images across seven emotion classes. To address the mismatch between VLM training assumptions and the noisy nature of FER data, we introduce a novel pipeline that integrates GFPGAN-based image restoration with FER evaluation. Results show that traditional models, particularly EfficientNet-B0 (86.44%) and ResNet-50 (85.72%), significantly outperform VLMs like CLIP (64.07%) and Phi-3.5 Vision (51.66%), highlighting the limitations of VLMs in low-quality visual tasks. In addi",2025,EAI Endorsed Transactions on AI and Robotics,Vamsi Krishna Mulukutla; Sai Supriya Pavarala; Srinivasa Raju Rudraraju; Sridevi Bonthu,10.4108/airo.8870,,https://doi.org/10.4108/airo.8870,crossref,vision language action model limitation robotics,hostile,failure,,1,vision language action model; limitation; benchmark; deployment,2026-06-12T14:45:03Z,11.997,19.997
doi:10.3390/s22072540,A Gaussian Process State Space Model Fusion Physical Model and Residual Analysis for Fatigue Evaluation,"Residual stress is closely related to the evolution process of the component fatigue state, but it can be affected by various sources. Conventional fatigue evaluation either focuses on the physical process, which is limited by the complexity of the physical process and the environment, or on monitored data to form a data-driven model, which lacks a relation to the degenerate process and is more sensitive to the quality of the data. This paper proposes a fusion-driven fatigue evaluation model based on the Gaussian process state–space model, which considers the importance of physical processes and the residuals. Through state–space theory, the probabilistic space evaluation results of the Gaussian process and linear physical model are used as the hidden state evaluation results and hidden state change observation function, respectively, to construct a complete Gaussian process state–space ",2022,Sensors,Aijun Yin; Junlin Zhou; Tianyou Liang,10.3390/s22072540,,https://doi.org/10.3390/s22072540,crossref,state space model robot policy,concept,architecture,,2,state space model robot policy,2026-06-12T15:07:36Z,18.949,19.949
arxiv:2508.19851v1,Tracking World States with Language Models: State-Based Evaluation Using Chess,"Large Language Models (LLMs) exhibit emergent capabilities in structured domains, suggesting they may implicitly internalize high-fidelity representations of world models. While probing techniques have shown promising signs of this in scientific and game-based settings, they rely on model-specific internal activations, which limit interpretability and generalizability. In this work, we propose a model-agnostic, state-based evaluation framework using chess as a benchmark to assess whether LLMs preserve the semantics of structured environments. Our method analyzes the downstream legal move distributions (state affordances) to estimate semantic fidelity between predicted and actual game states. This approach offers a more meaningful evaluation than conventional string-based metrics by aligning more closely with the strategic and rule-governed nature of chess. Experimental results demonstrat",2025,arXiv,Romain Harang; Jason Naradowsky; Yaswitha Gujju; Yusuke Miyao,,2508.19851v1,http://arxiv.org/abs/2508.19851v1,arxiv,robot world models manipulation,concept,world_models,,,robot world model; limitation; benchmark,2026-06-12T14:45:03Z,16.850,19.850
doi:10.1007/s40801-021-00277-0,Sodium-Glucose Cotransporter-2 Inhibitor Use is Associated with a Reduced Risk of Heart Failure Hospitalization in Patients with Heart Failure with Preserved Ejection Fraction and Type 2 Diabetes Mellitus: A Real-World Study on a Diverse Urban Population,,2022,Drugs - Real World Outcomes,Weijia Li; Adarsh Katamreddy; Rachna Kataria; Merle L. Myerson; Cynthia C. Taub,10.1007/s40801-021-00277-0,,https://doi.org/10.1007/s40801-021-00277-0,crossref,robot world model failure,anti_myopia,anti_thesis,,11,robot world model; robot world model failure,2026-06-12T15:07:36Z,14.842,19.842
title:lead me by the hand evaluation of a direct physical interface for nursing assistant robots,Lead Me by the Hand: Evaluation of a Direct Physical Interface for Nursing Assistant Robots,"Abstract—When a user is in close proximity to a robot, physical contact becomes a potentially valuable channel for communication. People often use direct physical contact to guide a person to a desired location (e.g., leading a child by the hand) or to adjust a person’s posture for a task (e.g., a dance instructor working with a dancer). Within this paper, we present an implementation and evaluation of a direct physical interface for a human-scale anthropomorphic robot. We define a direct physical interface (DPI) to be an interface that enables a user to influence a robot’s behavior by making contact with its body. Human-human interaction inspired our interface design, which enables a user to lead our robot by the hand and position its arms. We evaluated this interface in the context of assisting nurses with patient lifting, which we expect to be a high-impact application area. Our evalu",2010,SMARTech Repository (Georgia Institute of Technology),"Chen, Tiffany L.; Kemp, Charles C.",,,https://openalex.org/W2028026191,openalex,robotics,concept,openalex_bulk_robotics,,33,assistive robot,2026-06-12T18:57:17Z,18.813,19.813
doi:10.1525/elementa.2025.00089,Validating existing LDAR simulators using real-world data from British Columbia: A comparative study of FEAST and LDAR-Sim,"Methane-mitigation policies increasingly rely on simulation tools to design and evaluate Leak Detection and Repair (LDAR) programs, yet the extent to which these models reproduce real-world emissions remains unclear. This study provides the first direct, data-driven evaluation of 2 widely used open-source LDAR simulators, Fugitive Emissions Abatement Simulation Toolkit (FEAST) and the Leak Detection and Repair Simulator (LDAR-Sim), using a comprehensive regulatory dataset from the British Columbia Energy Regulator (BCER) covering 2020–2023. To ensure methodological alignment, simulations were configured to match empirical survey frequencies, optical gas imaging (OGI)-detection conditions, and BCER-calibrated leak generation parameters. Annual methane emissions from each model were compared with observed OGI-detectable emissions, and model behavior was further assessed through stratified ",2026,Elem Sci Anth,Jinya Wang; Zahra Ashena; Mozhou Gao; Sina Kiaei; Steve H. L. Liang,10.1525/elementa.2025.00089,,https://doi.org/10.1525/elementa.2025.00089,crossref,sim to real robot manipulation,concept,sim2real,,,robot manipulation; limitation; benchmark; robustness,2026-06-12T15:07:36Z,13.650,19.650
doi:10.1049/cvi2.12342,Egocentric action anticipation from untrimmed videos,"Abstract Egocentric action anticipation involves predicting future actions performed by the camera wearer from egocentric video. Although the task has recently gained attention in the research community, current approaches often assume that input videos are ‘trimmed’, meaning that a short video sequence is sampled a fixed time before the beginning of the action. However, trimmed action anticipation has limited applicability in real‐world scenarios, where it is crucial to deal with ‘untrimmed’ video inputs and the exact moment of action initiation cannot be assumed at test time. To address these limitations, an untrimmed action anticipation task is proposed, which, akin to temporal action detection, assumes that the input video is untrimmed at test time, while still requiring predictions to be made before actions take place. The authors introduce a benchmark evaluation procedure for metho",2025,IET Computer Vision,Ivan Rodin; Antonino Furnari; Giovanni Maria Farinella,10.1049/cvi2.12342,,https://doi.org/10.1049/cvi2.12342,crossref,vision language action model limitation robotics,hostile,failure,,,vision language action model; limitation; benchmark,2026-06-12T15:07:36Z,11.650,19.650
doi:10.24963/ijcai.2024/23,Deep Learning-Based Pedestrian Simulation with Limited Real-World Training Data: An Evaluation Framework,"Simulating pedestrian movement is important for applications such as disaster management, robotics, and game design. While deep learning models have been extensively used on related problems, their use as pedestrian simulators remains relatively unexplored. This paper aims to encourage more research in this direction in two ways. First, it proposes an evaluation framework that is applicable to both traditional and deep learning based simulators. Second, it proposes and evaluates several ideas related to input representation, choice of neural architecture, exploiting knowledge-based simulators in data poor regimes, and repurposing trajectory prediction models. Our extensive experiments provide several useful insights for future research in pedestrian simulation. The code is available at https://github.com/vmahzoon76/DL-Crowd-Sim.",2024,Proceedings of the Thirty-ThirdInternational Joint Conference on Artificial Intelligence,Vahid Mahzoon; Abigail Liu; Slobodan Vucetic,10.24963/ijcai.2024/23,,https://doi.org/10.24963/ijcai.2024/23,crossref,real world robot learning deployment,concept,deployment,,2,deployment,2026-06-12T15:07:36Z,16.649,19.649
doi:10.1108/ci-08-2025-0377,Real-world evaluation of automated defect detection in masonry bridges using 360° imagery with machine learning,"Purpose The purpose of this study is to evaluate different deep learning approaches, Convolutional Neural Networks (CNN), transformer, hybrid and commercial models, for automated defect detection in UK masonry railway bridges, in both laboratory and real-world settings, using high-resolution 360° imagery. Design/methodology/approach Expert-annotated imagery was categorised into six defect types, with SMOTE oversampling applied to mitigate class imbalance. Four widely used architectures, EfficientNet, Swin Transformer, ConvNeXt and Azure CustomVision, were benchmarked using compact variants in a two-stage design: laboratory data and real-world evaluation, to assess feasibility and generalisability. Findings All models achieved high performance on laboratory data (0.83–0.91 accuracy), demonstrating feasibility in controlled environments. However, when applied to real-world evaluation, accu",2026,Construction Innovation,Arijit Sen; Quanbin Sun; Song Wu; Saeed Talebi,10.1108/ci-08-2025-0377,,https://doi.org/10.1108/ci-08-2025-0377,crossref,real world robot learning deployment,concept,deployment,,1,benchmark; robustness; deployment; real world evaluation,2026-06-12T15:07:36Z,14.647,19.647
doi:10.20491/isarder.2023.1672,Evaluation of the use of Robotics in Hotels in terms of Customer Satisfaction,"Purpose:This study aims to evaluate the online guest comments made for all of the hotel businesses in the world that use robotic technology in the tourism industry and serve on the TripAdvisor website by content analysis methodDesign/methodology/approach –Content analysis model, one of the qualitative research methods, was used in this study. Accordingly, the comments made by customers on Tripadvisor were analyzed and examined under the main theme and sub-themes. Thus, it was determined on which subjects there were more complaintsResults –According to the research findings, it was understood that most of the complaints were about price/performance. Additionally, it was seen that the limited responses of the robotic technologies and autonomous systems used to solve the guest's problems were another critical reason for complaintsDiscussion–The increase in the use of robotic services, which",2023,Journal of Business Research - Turk,Kansu Gençer,10.20491/isarder.2023.1672,,https://doi.org/10.20491/isarder.2023.1672,crossref,EBM transformer robotics tool use robotics,concept,architecture_x_embodiment,,1,EBM transformer robotics; tool use robotics,2026-06-12T15:07:36Z,18.597,19.597
