uid,title,abstract,year,venue,authors,doi,arxiv_id,url,source,query,query_role,family,advisor_seed,citation_count,matched_terms,retrieved_at,relevance_score,hostile_score
arxiv:2601.21282v1,WorldBench: Disambiguating Physics for Diagnostic Evaluation of World Models,"Recent advances in generative foundational models, often termed ""world models,"" have propelled interest in applying them to critical tasks like robotic planning and autonomous system training. For reliable deployment, these models must exhibit high physical fidelity, accurately simulating real-world dynamics. Existing physics-based video benchmarks, however, suffer from entanglement, where a single test simultaneously evaluates multiple physical laws and concepts, fundamentally limiting their diagnostic capability. We introduce WorldBench, a novel video-based benchmark specifically designed for concept-specific, disentangled evaluation, allowing us to rigorously isolate and assess understanding of a single physical concept or law at a time. To make WorldBench comprehensive, we design benchmarks at two different levels: 1) an evaluation of intuitive physical understanding with concepts su",2026,arXiv,Rishi Upadhyay; Howard Zhang; Jim Solomon; Ayush Agrawal; Pranay Boreddy; Shruti Satya Narayana; Yunhao Ba; Alex Wong; Celso M de Melo; Achuta Kadambi,,2601.21282v1,http://arxiv.org/abs/2601.21282v1,arxiv,robot world model failure planning,hostile,failure,,,robot world model; benchmark; deployment; robot world model failure,2026-06-12T14:45:03Z,17.850,25.850
doi:10.3390/ai7040131,LLM-Based Control for Simulated Physical Reasoning: Modular Evaluation in the NeurIPS Embodied Agent Interface Challenge,"Benchmark-driven evaluation helps distinguish between planning quality and interface reliability when large language models are utilized for embodied reasoning in simulation. Our submission to the Embodied Agent Interface Challenge (EAI) is evaluated across four stages of the pipeline. These being goal interpretation, subgoal decomposition, action sequencing, and transition modeling. The tasks run in the BEHAVIOR and VirtualHome simulators, which use constrained action vocabularies, fixed-object inventories and symbolic state representations within a standard evaluation protocol. Our system accesses the OpenAI API using GPT-4.1 for BEHAVIOR, GPT-4.1-mini for VirtualHome, and GPT-5-mini in later exploratory experiments across both environments. The schemas for each task determine how the outputs are structured, and outputs are regenerated when they do not follow the specification. On the ",2026,AI,Hilmi Demirhan; Wlodek Zadrozny,10.3390/ai7040131,,https://doi.org/10.3390/ai7040131,crossref,embodied world model planning control,concept,world_models,,,embodied agent; limitation; benchmark,2026-06-12T15:07:36Z,20.650,23.650
doi:10.1007/s40194-025-02293-y,Fatigue life evaluation of root failure in welded joints based on displacement around the weld root,"Abstract Unanticipated load transfer in load-carrying cruciform and butt-welded joints with incomplete penetration can initiate fatigue cracks from the weld root. Conventionally, the fatigue life of such joints is assessed using the nominal stress approach. However, this method is often inadequate for geometrically complex joints, particularly when the weld throat nominal stress cannot be clearly defined due to non-uniform stress distribution. Although the effective notch stress (ENS) method provides an alternative, it is computationally demanding and relies on an assumed notch radius which lacks a well-defined physical basis. This study proposes an alternative fatigue evaluation method based on displacement around the weld root, offering a physically meaningful and mesh-insensitive fatigue damage parameter. A linear-elastic finite element model with a 1 mm mesh around the unfused zone w",2025,Welding in the World,Erik Wahyu Pradana; Kazuo Tateishi; Takeshi Hanji; Masaru Shimizu,10.1007/s40194-025-02293-y,,https://doi.org/10.1007/s40194-025-02293-y,crossref,robot world model failure,anti_myopia,anti_thesis,,,robot world model; robot world model failure,2026-06-12T15:07:36Z,18.600,23.600
arxiv:2506.00613v3,WorldGym: World Model as An Environment for Policy Evaluation,"Evaluating robot control policies is difficult: real-world testing is costly, and handcrafted simulators require manual effort to improve in realism and generality. We propose a world-model-based policy evaluation environment (WorldGym), an autoregressive, action-conditioned video generation model which serves as a proxy to real world environments. Policies are evaluated via Monte Carlo rollouts in the world model, with a vision-language model providing rewards. We evaluate a set of VLA-based real-robot policies in the world model using only initial frames from real robots, and show that policy success rates within the world model highly correlate with real-world success rates. Moreoever, we show that WorldGym is able to preserve relative policy rankings across different policy versions, sizes, and training checkpoints. Due to requiring only a single start frame as input, the world model",2025,arXiv,Julian Quevedo; Ansh Kumar Sharma; Yixiang Sun; Varad Suryavanshi; Percy Liang; Sherry Yang,,2506.00613v3,http://arxiv.org/abs/2506.00613v3,arxiv,adaptive world action model robot,concept,wam,,,world action model; adaptive world action model; generalization; deployment,2026-06-12T14:45:03Z,19.200,23.200
arxiv:2603.28545v1,ManipArena: Comprehensive Real-world Evaluation of Reasoning-Oriented Generalist Robot Manipulation,"Vision-Language-Action (VLA) models and world models have recently emerged as promising paradigms for general-purpose robotic intelligence, yet their progress is hindered by the lack of reliable evaluation protocols that reflect real-world deployment. Existing benchmarks are largely simulator-centric, which provide controllability but fail to capture the reality gap caused by perception noise, complex contact dynamics, hardware constraints, and system latency. Moreover, fragmented real-world evaluations across different robot platforms prevent fair and reproducible comparison. To address these challenges, we introduce ManipArena, a standardized evaluation framework designed to bridge simulation and real-world execution. ManipArena comprises 20 diverse tasks across 10,812 expert trajectories emphasizing reasoning-oriented manipulation tasks requiring semantic and spatial reasoning, suppor",2026,arXiv,Yu Sun; Meng Cao; Ping Yang; Rongtao Xu; Yunxiao Yan; Runze Xu; Liang Ma; Roy Gan; Andy Zhai; Qingxuan Chen; Zunnan Xu; Hao Wang; Jincheng Yu; Lucy Liang; Qian Wang; Ivan Laptev; Ian D Reid; Xiaodan Liang,,2603.28545v1,http://arxiv.org/abs/2603.28545v1,arxiv,robot world models manipulation,concept,world_models,,,robot world model; robot manipulation; mobile manipulation; contact dynamics; benchmark; generalization; out of distribution; deployment; real world evaluation; long horizon; latency,2026-06-12T14:45:03Z,16.850,22.850
doi:10.52783/jisem.v10i50s.10219,Self-Supervised Learning for Generalizable AI: Bridging the Gap Between Pretraining and Real-World Deployment,Representation learning received a breakthrough with self-supervised learning (SSL) because it uses big unlabeled datasets to remove the need for human annotation. The robustness of SSL models weakens quickly during real-world deployment because they struggle to perform well in domain shift situations and out-of-distribution (OOD) environments. The critical limitation of poor generalization across different environments receives a solution from this research through the creation of Causal-Contrastive Self-Supervised Learning (C2SSL) which merges contrastive learning with causal inference to discover invariant features. The main breakthrough stems from constructing causal models of data structures to make models focus on constant features while decreasing the impact of spurious pattern correlations that normally degrade generalization results. The evaluation of our method occurs in three ,2025,Journal of Information Systems Engineering and Management,Mohammed Basil Abdulkareem,10.52783/jisem.v10i50s.10219,,https://doi.org/10.52783/jisem.v10i50s.10219,crossref,real world robot learning deployment,concept,deployment,,,self supervised learning; limitation; generalization; out of distribution; robustness; ablation; deployment,2026-06-12T15:07:36Z,13.650,22.650
doi:10.1609/aaai.v39i27.35109,From Large Language Models to Large Action Models: Reasoning and Planning with Physical World Knowledge,"While Large Language Models excel in language processing, Large Agent Models are designed to interact with the environment. This transition poses significant challenges in understanding lower-level visual details, and long-horizon reasoning for effective goal interpretation and decision-making. Despite the impressive performance of LLMs/VLMs on various benchmarks, these models perceive images as bags of words (semantic concepts). In detail, they use semantic understanding as a shortcut but lack the ability to recognize geometric structures or solve spatial problems such as mazes. To interact with the physical world, we focus on two dimensions: (1) From high-level semantic to low-level geometric understanding: We introduce a low-level visual description language that serves as geometric tokens, allowing the abstraction of multimodal low-level geometric structures. (2) From fast-thinking t",2025,Proceedings of the AAAI Conference on Artificial Intelligence,Manling Li,10.1609/aaai.v39i27.35109,,https://doi.org/10.1609/aaai.v39i27.35109,crossref,large language model limitation robot planning,anti_myopia,anti_thesis,,,limitation; benchmark; long horizon; large language model limitation robot planning,2026-06-12T15:07:36Z,17.250,22.250
arxiv:2605.08567v2,ACWM-Phys: Investigating Generalized Physical Interaction in Action-Conditioned Video World Models,"Action-conditioned world models (ACWMs) have shown strong promise for video prediction and decision-making. However, existing benchmarks are largely restricted to egocentric navigation or narrow, task-specific robotics datasets, offering only limited coverage of the rich physical interactions required for generalized world understanding. We introduce ACWM-Phys, a new benchmark for evaluating action-conditioned prediction under diverse physical dynamics in a clean, controllable simulation environment with a carefully designed action space. ACWM-Phys contains training and evaluation data spanning rigid-body dynamics, kinematics, deformable-object interactions, and particle dynamics. To evaluate both interpolation and generalization, we design in-distribution and out-of-distribution protocols with controlled shifts in interaction patterns or scene configurations. By building the benchmark i",2026,arXiv,Haotian Xue; Yipu Chen; Liqian Ma; Zelin Zhao; Lama Moukheiber; Yuchen Zhu; Yongxin Chen,,2605.08567v2,http://arxiv.org/abs/2605.08567v2,arxiv,world action model,concept,architecture,,,world action model; benchmark; generalization; out of distribution; ablation,2026-06-12T15:07:36Z,16.850,21.850
doi:10.1038/s42256-024-00964-x,Causal chambers as a real-world physical testbed for AI methodology,"Abstract In some fields of artificial intelligence, machine learning and statistics, the validation of new methods and algorithms is often hindered by the scarcity of suitable real-world datasets. Researchers must often turn to simulated data, which yields limited information about the applicability of the proposed methods to real problems. As a step forward, we have constructed two devices that allow us to quickly and inexpensively produce large datasets from non-trivial but well-understood physical systems. The devices, which we call causal chambers, are computer-controlled laboratories that allow us to manipulate and measure an array of variables from these physical systems, providing a rich testbed for algorithms from a variety of fields. We illustrate potential applications through a series of case studies in fields such as causal discovery, out-of-distribution generalization, chang",2025,Nature Machine Intelligence,Juan L. Gamella; Jonas Peters; Peter Bühlmann,10.1038/s42256-024-00964-x,,https://doi.org/10.1038/s42256-024-00964-x,crossref,causal robot world model,concept,architecture,,8,robot world model; causal robot world model; generalization; out of distribution,2026-06-12T15:07:36Z,17.749,21.749
doi:10.5194/wbf2026-818,Planning Land Use Strategies for Transformative Change in a Changing World,"In this presentation, I explore framings of land use planning as a practice and paradigm within the context of transformative change. Land use is an interesting perspective to take on transformative change; it can be a driver of biodiversity loss and climate change, but can also offer opportunities for mitigating or adapting to change. It is also a site through which the social interacts with the physical by shaping how people interact with land, with what outcomes. In particular, I flag that land use planning can shape decisions that have the potential to address or exacerbate injustice within transformative change, for example in influencing who is impacted by environmental problems, and who benefits from interventions. Within this framing, land use planning must bridge understandings of social and physical systems, often incorporating multi-level, multi-sectoral requirements, and prov",,,Julia Leventon,10.5194/wbf2026-818,,https://doi.org/10.5194/wbf2026-818,crossref,robot world model failure planning,hostile,failure,,,robot world model; robot world model failure,2026-06-12T15:07:36Z,17.650,21.650
doi:10.1007/s40801-025-00524-8,Real-World Evaluation of Regulatory Judgments on Anticancer Drug Use During Pregnancy in Japan: A Retrospective Analysis from 2004 to 2024,,2025,Drugs - Real World Outcomes,Hitoshi Kanno; Kotone Matsuyama,10.1007/s40801-025-00524-8,,https://doi.org/10.1007/s40801-025-00524-8,crossref,real world robot learning deployment,concept,deployment,,,deployment; real world evaluation,2026-06-12T15:07:36Z,18.600,21.600
doi:10.1109/lra.2021.3115406,SuctionNet-1Billion: A Large-Scale Benchmark for Suction Grasping,"Suction is an important solution for the longstanding robotic grasping problem. Compared with other kinds of grasping, suction grasping is easier to represent and often more reliable in practice. Though preferred in many scenarios, it is not fully investigated and lacks sufficient training data and evaluation benchmarks. To address that, firstly, we propose a new physical model to analytically evaluate seal formation and wrench resistance of a suction grasping, which are two key aspects of grasp success. Secondly, a two-step methodology is adopted to generate annotations on a large-scale dataset collected in real-world cluttered scenarios. Thirdly, a standard online evaluation system is proposed to evaluate suction poses in continuous operation space, which can benchmark different algorithms fairly without the need of exhaustive labeling. Real-robot experiments are conducted to show that",2021,arXiv,Hanwen Cao; Hao-Shu Fang; Wenhai Liu; Cewu Lu,10.1109/lra.2021.3115406,2103.12311v2,http://arxiv.org/abs/2103.12311v2,arxiv,analytical grasping,anti_myopia,anti_thesis,,,benchmark; analytical grasping,2026-06-12T15:07:36Z,15.350,21.350
doi:10.48550/arxiv.2411.02385,How Far is Video Generation from World Model: A Physical Law Perspective,"OpenAI's Sora highlights the potential of video generation for developing world models that adhere to fundamental physical laws. However, the ability of video generation models to discover such laws purely from visual data without human priors can be questioned. A world model learning the true law should give predictions robust to nuances and correctly extrapolate on unseen scenarios. In this work, we evaluate across three key scenarios: in-distribution, out-of-distribution, and combinatorial generalization. We developed a 2D simulation testbed for object movement and collisions to generate videos deterministically governed by one or more classical mechanics laws. This provides an unlimited supply of data for large-scale experimentation and enables quantitative evaluation of whether the generated videos adhere to physical laws. We trained diffusion-based video generation models to predic",2024,arXiv (Cornell University),Bingyi Kang; Yue Yang; Rui Lu; Zhijie Lin; Yang Zhao; Kaixin Wang; Gao Huang; Jiashi Feng,10.48550/arxiv.2411.02385,,https://doi.org/10.48550/arxiv.2411.02385,openalex,energy based transformer robot policy,concept,ebm_transformer,,4,energy based transformer robot policy; generalization; out of distribution,2026-06-12T18:05:07Z,17.305,21.305
doi:10.20944/preprints202606.0425.v1,The Evaluation Bottleneck of Vision-Language-Action Models: A Evaluation-Centric Survey,"Vision-Language-Action (VLA) models are advancing faster than the field can evaluate them reliably. Researchers use different metrics and lab-specific protocols, making it hard to tell whether reported gains reflect genuine progress or favorable evaluation choices. We present the first comprehensive benchmark-centric survey of VLA evaluation, covering 582 papers from 2023 to May 2026. We argue that a benchmark number supports a progress claim only if four conditions hold: the benchmark discriminates among top models; metrics capture the claimed capability; the procedure permits cross-paper comparison; and the inference from benchmark to deployment is valid. Current practice fails at all four. Benchmark choice is concentrated and saturated, with leading models clustering near the ceiling of dominant simulation suites. Metric reporting is one-dimensional, dominated by task success rate whi",,,Zirui Song; Huaxing Liu; Xiang Wang; Shuai Li; Xinye Li; Yuheng Ji; Lang Gao; Jinghui Zhang; Xianhui Meng; Xiaojun Chang; Xiuying Chen,10.20944/preprints202606.0425.v1,,https://doi.org/10.20944/preprints202606.0425.v1,crossref,vision language action model limitation robotics,hostile,failure,,,vision language action model; limitation; benchmark; deployment; real world evaluation,2026-06-12T15:07:36Z,12.300,21.300
doi:10.18196/jrc.v4i6.20216,Enhancing Fault Detection in Wireless Sensor Networks Through Support Vector Machines: A Comprehensive Study,"The Wireless Sensor Network (WSN) consists of many sensors that are distributed in a specific area for the purpose of monitoring physical conditions. Factors such as hardware limitations, limited resources, unfavourable WSN deployment environment, and the presence of various attacks on nodes can lead to the presence of Faulty Nodes in a WSN. This raises the problem of detecting Faulty Nodes and avoiding Data loss. Detecting Faulty Nodes in real-world scenarios will improve the quality of a WSN. The research was aimed at developing an algorithm to determine the location of Faulty Nodes in a WSN. The algorithm uses characteristics of Machine Learning and Support Vector Machines (SVM), which use the classification of Data into true and false. A Mathematical Model for determining Faulty Nodes using the SVM is considered. A methodology for detecting a Faulty Node is demonstrated, which consis",2023,Journal of Robotics and Control (JRC),Yerik Mardenov; Aigul Adamova; Tamara Zhukabayeva; Mohamed Othman,10.18196/jrc.v4i6.20216,,https://doi.org/10.18196/jrc.v4i6.20216,crossref,classical control robotics,anti_myopia,anti_thesis,,7,limitation; deployment; classical control robotics,2026-06-12T15:07:36Z,14.240,21.240
doi:10.3390/robotics10010045,Cobot User Frame Calibration: Evaluation and Comparison between Positioning Repeatability Performances Achieved by Traditional and Vision-Based Methods,"Since cobots are designed to be flexible, they are frequently repositioned to change the production line according to the needs; hence, their working area (user frame) needs to be often calibrated. Therefore, it is important to adopt a fast and intuitive user frame calibration method that allows even non-expert users to perform the procedure effectively, reducing the possible mistakes that may arise in such contexts. The aim of this work was to quantitatively assess the performance of different user frame calibration procedures in terms of accuracy, complexity, and calibration time, to allow a reliable choice of which calibration method to adopt and the number of calibration points to use, given the requirements of the specific application. This has been done by first analyzing the performances of a Rethink Robotics Sawyer robot built-in user frame calibration method (Robot Positioning S",2021,Robotics,Roberto Pagani; Cristina Nuzzi; Marco Ghidelli; Alberto Borboni; Matteo Lancini; Giovanni Legnani,10.3390/robotics10010045,,https://doi.org/10.3390/robotics10010045,crossref,vision language action model limitation robotics,hostile,failure,,21,vision language action model; limitation,2026-06-12T15:07:36Z,15.046,21.046
arxiv:2603.04363v1,ManipulationNet: An Infrastructure for Benchmarking Real-World Robot Manipulation with Physical Skill Challenges and Embodied Multimodal Reasoning,"Dexterous manipulation enables robots to purposefully alter the physical world, transforming them from passive observers into active agents in unstructured environments. This capability is the cornerstone of physical artificial intelligence. Despite decades of advances in hardware, perception, control, and learning, progress toward general manipulation systems remains fragmented due to the absence of widely adopted standard benchmarks. The central challenge lies in reconciling the variability of the real world with the reproducibility and authenticity required for rigorous scientific evaluation. To address this, we introduce ManipulationNet, a global infrastructure that hosts real-world benchmark tasks for robotic manipulation. ManipulationNet delivers reproducible task setups through standardized hardware kits, and enables distributed performance evaluation via a unified software client",2026,arXiv,Yiting Chen; Kenneth Kimble; Edward H. Adelson; Tamim Asfour; Podshara Chanrungmaneekul; Sachin Chitta; Yash Chitambar; Ziyang Chen; Ken Goldberg; Danica Kragic; Hui Li; Xiang Li; Yunzhu Li; Aaron Prather; Nancy Pollard; Maximo A. Roa-Garzon; Robert Seney; Shuo Sha; Shihefeng Wang; Yu Xiang,,2603.04363v1,http://arxiv.org/abs/2603.04363v1,arxiv,robot world models manipulation,concept,world_models,,,robot world model; robot manipulation; dexterous manipulation; benchmark; reproducibility; deployment,2026-06-12T14:45:03Z,16.850,20.850
doi:10.21203/rs.3.rs-9323275/v1,DMES: Information-Equivalent Evaluation Reveals the Physical Reasoning Gap Between World Models and Language Models,"Abstract Evaluating physical reasoning across fundamentally different architectures—large language models (LLMs) and vision-based world models—is confounded by the fact that text and image inputs carry naturally non-equivalent information. We propose Dual-Mode Equivalent Stimulus (DMES), an evaluation framework that constructs text-image pairs with rigorously equal information content (H(T) =H(I) = H(S)), eliminating modality confounds from cross-architecture comparisons. Applying DMES to classical mechanics, we create DMES-PC, a 140-sample benchmark spanning 7 physics categories, and evaluate three LLMs (GLM-4.7, Qwen3-Coder-Next, Gemma 4; 26B–355B parameters) against V-JEPA 2 (300M parameters) under three evaluation paradigms. Our results reveal a clear parameter efficiency paradox: V-JEPA 2 achieves both higher prediction accuracy (mean score 0.692, SD=0.032) and substantially lower v",,,Liutao Hu,10.21203/rs.3.rs-9323275/v1,,https://doi.org/10.21203/rs.3.rs-9323275/v1,crossref,robot world models manipulation,concept,world_models,,,robot world model; benchmark,2026-06-12T15:07:36Z,17.650,20.650
doi:10.1155/2018/9791286,The Design and Evaluation of an Ergonomic Contactless Gesture Control System for Industrial Robots,"In industrial human-robot collaboration, variability commonly exists in the operation environment and the components, which induces uncertainty and error that require frequent manual intervention for rectification. Conventional teach pendants can be physically demanding to use and require user training prior to operation. Thus, a more effective control interface is required. In this paper, the design and evaluation of a contactless gesture control system using Leap Motion is described. The design process involves the use of RULA human factor analysis tool. Separately, an exploratory usability test was conducted to compare three usability aspects between the developed gesture control system and an off-the-shelf conventional touchscreen teach pendant. This paper focuses on the user-centred design methodology of the gesture control system. The novelties of this research are the use of human",2018,Journal of Robotics,Gilbert Tang; Phil Webb,10.1155/2018/9791286,,https://doi.org/10.1155/2018/9791286,crossref,classical control robotics,anti_myopia,anti_thesis,,29,industrial robot; classical control robotics,2026-06-12T15:07:36Z,14.551,20.551
